recipeID,recipe_name,summary,ingredient_name,full_step,category,image_link
433,양파장아찌 만드는 법,은은하게 짠맛과 단맛이 오묘하게 조화된 영양 만점 반찬~ 양파장아찌!,[재료] 양파  5~6개 [양념] 맛간장  1컵 물  1+1/2컵 식초  1컵 매실즙  1컵 통마늘  10쪽 레몬즙  다시마 ,"양파는 먹기좋은 크기로 잘라서 준비해 주세요. 맛간장, 물, 식초, 매실즙, 통마늘, 레몬즙, 다시마 를 넣고 끓여 주다가 다시마는 먼저 건져 주세요~ 설탕 대신 매실즙을 넣어주었는데 장아찌맛이 훨씬 좋더라구요~ 병은 미리 소독을 해서 준비해 주시구요. 썰어둔 양파를 차곡차곡 담아 주세요~ 체에 받혀 건더기와 국물을 분리합니다 뜨거울때 간장육수를 부어주시고 윗부분에 무거운걸 올려 양파가 위에 뜨는걸 막아 주셔야 합니다. 이렇게 실온에서 하루 정도 놔두시고 냉장고에 넣어두심 되는데요. 혹시 양이 많으면 3~4일후에 국물만 따라내어 한번 우르르 끓이고 식혀준 다음 그릇에 부어 주시면 조금 오랫동안 두고 먹을수 있어요~",피로회복,https://recipe1.ezmember.co.kr/cache/recipe/2015/04/22/591a03a8c1332cf852eeae7a84ff31031_m.jpg
434,피로회복에 좋은 꿀자몽,피로회복에 좋은 꿀자몽 소개합니다.,[재료] 자몽  [양념] 꿀 ,일반자몽보다 조금 더 달콤한 맛이 있는 스위티자몽으로 준비했어요. 자몽은 반으로 잘라주세요. 과도를 이용해서 과육에 맞게 둥근모양으로 칼집을 넣어주세요. 알맹이 하나하나 떨어질수 있도록 사이사이에도 칼집을 넣어주세요. 꿀 한큰술을 자몽위에 뿌려주세요. 꿀이 자몽 사이사이에 부드럽게 스며들었어요.,피로회복,https://recipe1.ezmember.co.kr/cache/recipe/2015/06/06/0aae89790a595527a6ed61501f42fec31_m.jpg
435,매실장아찌,피로회복에 좋은 매실엑기스를 만들었어요.,[재료] 매실  3kg [양념] 소금물  설탕  1.2kg,두어번 정도 씻은 다음 소금을 넉넉히 풀어 소금물에 절여둘거에요. 10시간이상 절이기 소금물에 절인 매실을 체반에 받쳐 물기를 빼주고 매실씨랑 과육 분리시키기. (소주병으로 내리치면 쉬워요) 다시 한번 씻어서 물기를 빼고 열탕 소독해주고 씨를 뺀 과육이 3kg 조금 못되기에 설탕은 1.2kg만 준비했어요. 잘 버무린다음 위에 올릴 설탕을 제외하고 나머지는 전부다 씨를 뺀 과육에 담아 버무려줍니다. 병에 담고 설탕을 넣어줬어요. 매실액기스 완성,피로회복,https://recipe1.ezmember.co.kr/cache/recipe/2015/06/10/f3275d9892e1e599bff4d9fdd55989ef1_m.jpg
436,피로회복에 좋은 씀바귀 무침,"쓴만큼 몸에 아주 좋은 씀바귀. 피로감을 해소하는 각종 아미노산이 풍부하게 들어 있고, 산모들에게 좋은 요리인 씀바귀 무침입니다.",[재료] 씀바귀  구운김  2장 소금  약간 쌀뜨물  [양념] 고추장  2큰술 고운 고추가루  1작은술 다진파  1큰술 다진마늘  1작은술 생강즙  1/4작은술 물엿  2큰술 참기름  1/4작은술 통깨  1작은술 소금  약간,먼저 씀바귀는 흙을 깨끗이 씻은 후 쌀뜨물에 30분 담궈놓습니다. 쌀뜨물은 쓴맛과 아린맛을 빼주는 데 효과적입니다. 굵은 소금도 약간 넣어줍니다. 분량대로 양념장을 만듭니다. 씀바귀는 먹기 좋게 자르고 구운김을 찢어 넣고 양념장을 넣습니다. 그리고 무쳐주면 먹음직스러운 씀바귀 무침이 완성됩니다.,피로회복,https://recipe1.ezmember.co.kr/cache/recipe/2015/06/02/fc5e0bb7fe40de356ddd1dbff3a0fea71_m.JPG
437,피로회복에 좋은 마늘꿀탕,"만들기도 쉽고 정말 간단하지만 건강에 좋을거 같아 소개해드립니다~ 마늘의 효능은 많이들 알고 계시겠지요~ 마늘꿀탕 숙취,숙변에 좋고 피로회복에도 좋다고 하니 추석피로도 풀고 감기도 예방하구요 마늘꿀탕 만들어서 두고두고 먹으면 좋을거 같아요~",[재료] 마늘  20쪽 꿀  8큰술,마늘과 꿀을 준비해주세요~ 꿀대신 조청을 넣으셔도 좋구요.병은 끓는물에 소독해서 말려 준비해주세요~ 마늘은 깨끗하게 씻어 키친타올로 물기를 제거해주시구요~ 깐마늘이 남았을때는 비닐팩에 넣어 냉동실 보관해주시면 유용하게 사용할수 있답니다 마늘양은 취향껏 조절하셔도 좋아요 김오른 찜기에 마늘을 20분정도 쪄주신후에 냄비에 넣어 방망이나 숟가락으로 으깨어주세요 찐마늘이라 숟가락으로 으깨어도 잘 으깨어 지더라구요~ 여기에 꿀을 넣어 섞어주시구요 만약에 고운 꿀탕을 원하시면 마늘에 꿀을 넣어 블렌더로 갈아주셔도 좋을거 같아요~ 냄비에 으깬마늘과 꿀을 섞어서 약불에서 약 10분정도 끓여주시면 완성입니다~병에 담아 2~3일 후에 차처럼 타 드시면 된답니다~ 이때 레몬즙을 살짝 넣어서 마셔도 좋답니다~ 레몬이 있다면 슬라이스해서 띄워 드셔도 좋구요~,피로회복,https://recipe1.ezmember.co.kr/cache/recipe/2015/04/02/a788ebf114094dc50e43dab4a3ce51b41_m.jpg
438,피로회복에 좋은 고추순 무침,피로에 시달리는 현대인들에게 좋은 고추순 무침,[재료] 고추순 200g [양념] 참기름  1T 청장 1t 깨소금  가는소금  약간,"텃밭에서 따온 고추순은 잎사귀 뒷쪽을 살펴 다듬습니다.... 끓는 물에 소금 넣어 살짝 데치고 찬물에 얼른 서너번 행궈요. 청장..즉..맑은 집간장을 1작은술 넣고 나머지는 참기름, 깨소금, 소금으로 무칩니다. 깨소금은 듬뿍, 청장은 아주 살짝 넣고 무쳐야 맛있어요. 고추순 무침 완성~",피로회복,https://recipe1.ezmember.co.kr/cache/recipe/2015/04/17/0ab2db30ba21953db16487f16d6e6f3d1_m.jpg
439,코다리 꽈리고추 간장조림,코다리는 동태를 반건조시킨것인데요~ 쫄깃하면서 지방이 적고 열량이 적어 다이어트식품으로도 좋아요. 꽈리고추를 넣어 매콤하면서도 쫄깃 달콤짭쪼름한게 밥반찬으로 아주 좋답니다. 오늘 밥반찬으로 코다리꽈리고추간장조림 어떠세요?,[재료] 코다리  2마리 꽈리고추  20개 [양념] 멸치육수  2컵 (400ml) 간장  5큰술 맛술  2큰술 청주  3큰술 매실청  1큰술 설탕  2큰술 다진마늘  1/2큰술 생강가루(생강즙)  약간,"멸치다시육수를 내주시는데요. 국멸치20마리,대파흰부분2개,파뿌리3~4개,다시마1개를 넣어 팔팔 끓으면 다시마는 건져주시고 중불에서 15분정도 더 끓여 진한 멸치육수를 만들어주세요. 코다리는 지느러미를 정리한후에 깨끗이 씻어주시고 꽈리고추를 깨끗이 씻어주세요. 꽈리고추는 이쑤시개로 구멍을 내주시고 반 잘라 준비해주세요. 양념재료를 냄비에 모두 넣어 끓어오르면 코다리를 넣어 센불에서 국물이 자작해질때까지 끓여주세요. 국물이 거의 졸여질때쯤 꽈리고추를 넣어 후다닥 섞어주시고 한번 끓여주시면 완성입니다.",피로회복,https://recipe1.ezmember.co.kr/cache/recipe/2015/05/01/bb1ffd28c367935b00d8cb2fba961e361_m.jpg
440,아삭아삭 꽈리고추 연근조림,연근에는 좋은성분이 듬뿍 들어있기 때문에 밑반찬으로 만들어 자주 식탁에 올리면 좋은데.. 제가 자주 만드는 연근요리중 하나인 꽈리고추연근조림 이에요~,[재료] 연근  470g 꽈리고추  40g 올리고당  1숟갈 참기름  1숟갈 통깨  약간 [양념] 간장  12숟갈 물  12숟갈 설탕  2+1/2숟갈 생강술  4숟갈 올리고당  3숟갈,연근은 껍질을 벗긴후 도톰하게 슬라이스해준후 식초를 탄 물에 10분정도 삶아줍니다~ 연근을 이렇게 한번 삶아내고 조리면 아삭하고 탱탱한 식감을 즐길수가 있습니다. 삶지 않고 바로 조리면 아삭하지 않고 쭈글쭈글 해진답니다~ 삶은 연근은 체에 받쳐 잠시 둡니다. 꽈리고추는 절반으로 썰어 준비해주세요~ 꽈리고추를 긴채로 그냥 넣으니 잘 안먹게 되더라구여~ 2~3등분으로 썰어 넣는게 좋은것 같아요~ 팬에 조림장 재료를 모두 넣고 팔팔 끓어오르면 불을 중약불로 줄인 후 삶아낸 연근을 넣고 조려줍니다~ 조림류의 음식을 만들때에는 절대 불을 센불에서 조리지 말고 중약불이나 약불에서 여유있게 조려주세요~ 센불에서 조려버리면 빨리 졸아들어서 간장이 베어들기 때문에 음식이 엄청 짜게 되어요~ 서서히 조리면 색도 이쁘고 짜지않게 된답니다~ 조림장이 절반정도 졸아들때까지 주걱으로 가끔 뒤적여주며 조려주다가 조림장이 절반정도 졸아들면 꽈리고추를 넣어줍니다~ 꽈리고추가 살짝 숨이 죽을정도로 조금만 더 조려주세요~ 불끄기 직전에 올리고당 한 숟갈이랑 참기름 한 숟갈 넣어줍니다. 통깨 뿌려내면 완성이에요~,피로회복,https://recipe1.ezmember.co.kr/cache/recipe/2015/04/04/778c6eebc458cb0fddc1e0a1a3ad3cd01_m.jpg
441,문어 꽈리고추 조림,"꽈리고추 조림에는 평소 멸치를 자주 이용하는데, 말린 문어를 넣어보았어요. 양념도 쉽고 맛있게 먹을 수 있는 밑반찬 만들기 지금부터 시작해봅니다.",[재료] 문어(마른것)  꽈리고추  [양념] 고추장  1스푼 고춧가루  1스푼 간장  1스푼 물엿  2스푼,"꽈리고추를 먼저 살짝 데쳐줍니다. 데치지 않으려면 이수씨개로 콕콕 찔러 수분이 빠져나올 공간을 만들어 주어야 양념이 골고루 베인답니다. 마른 문어를 볶아주세요. 식용유를 살짝 두르고 다진 마늘을 넣어서 볶았어요. 고추장 한스푼, 고춧가루 한스푼, 간장 한스푼, 물엿 2스푼을 넣어서 버무려 주세요. 문어가 잘 볶아진 다음에 꽈리 고추를 넣어서 함께 볶아줍니다.깨를 뿌려 마무리하면 완성.",피로회복,https://recipe1.ezmember.co.kr/cache/recipe/2015/04/04/50f68ba93e8142c1a131924bd31facfd1_m.jpg
442,감칠맛 나는 멸치 꽈리고추 볶음,칼한 매운맛과 달콤 짭쪼름 고소한 감칠맛을 내주는 4종 콜라보 멸치꽈리볶음 만들었어요.,[재료] 꽈리고추  1줌 중멸치  1줌 [양념] 간장  올리고당(설탕)  참기름  통깨 ,"꼭지는 떼내고 흐르는 물에 여러번 헹궈건져내고 물기를 뺀다음 고추가 너무 크면 사선으로 잘라내 속까지 양념이 잘 베이도록 해주시구요. 크기가 적당하면 그냥 해도 무방해요,. 올리브유를 넉넉히 두르고 꽈리고추를 먼저 볶아주세요. 중불에서 타지 않도록 코딩을 입힌다고 생각하시면 되겠네요. 개인적으로 아삭한 식감이 별로다 하시는분들은 팔팔 끓는물에 30초만 데쳐주세요. 크기에 따라 데치는 시간이 달라지겠죠? 저는 중멸치를 사용했구요. 내장과 머리부분을 다 손질한후 넣었어요. 살살 섞어준다음 간장을 3수저 넣어주시고 이때도 중불~ 간장 들어가면 차르르르르 탈수도 있어요. 올리고당이나 설탕도 1수저 넣어주시고 볶아주세요. 매운맛과 달큰함 그리고 은근히 짭짤한 감칠맛이 정말 맛있어요. 적당히 볶아졌으면 불을 끄고 참기름 1수저 둘러주고, 뒤적뒤적 거려준다음에 마무리.",피로회복,https://recipe1.ezmember.co.kr/cache/recipe/2015/05/18/9fb16b3f69912becd7485148c287207e1_m.JPG
443,쫄깃한 표고버섯전,"향긋한 표고버섯과 돼지고기, 갖은 채소 등으로 표고버섯전을 만들어 보았는데요, 느끼하지도 않고 쫄깃쫄깃한 식감으로 맛있게 즐길 수 있었습니다.",[재료] 표고버섯  돼지고기(다짐육)  달걀  당근  부추  양파  [양념] 다진마늘  맛술  소금  후춧가루  약간 밀가루  식용유  적당량 [초간장재료] 식초  양조간장 ,"표고버섯은 끓는 물에 살짝 데친 후 찬물에 헹구어 물기를 뺀 다음기둥을 제거해주세요. 돼지고기에 소금, 맛술, 후춧가루를 뿌려 치대어주세요. 돼지고기에 송송 썬 부추, 당근, 양파, 다진 마늘을 넣고 재료가 잘 섞이도록여러 번 치대어주세요. 표고버섯 안쪽에 밀가루를 발라주세요. 밀가루를 바르고 전을 부치면 돼지고기가 떨어지지 않아서 좋답니다. 표고버섯에 소를 넣고 꾹꾹 눌러 납작하게 만들어주세요. 밀가루 옷을 입혀주세요. 밀가루 옷을 입힌 표고버섯은 달걀물을 입혀주세요. 달군 프라이팬에 식용유를 두르고 달걀물을 입힌 표고버섯을 넣고 앞뒤로 노릇노릇하게 지진 후 키친타월 위에 올려 기름기를 빼주세요. 표고버섯전을 접시에 담고 초간장을 곁들여냅니다.",피로회복,https://recipe1.ezmember.co.kr/cache/recipe/2015/04/04/9e76e3fc6c45740bf13a0a2cb95d5bc71_m.jpg
444,표고버섯 불고기,"건강에 좋은 표고버섯을 넣어, 언제나 가족들에게 사랑받고있는 단골반찬 불고기를 만들었어요~",[재료] 불고기감  500g 표고버섯  홍고추  잔파  양파  [양념] 간장  4큰술 배효소 4큰술 마늘  1큰술 생강즙  1큰술 청주  1큰술 후추  참기름 ,"맛있는 불고기를 만들기위해먼저 핏물제거를 해주었어여~ 갓 도축한 신선한 소일수록 핏물도 많이 나온다고하니핏물제거는 꼭 해주시는게 좋겠져~ 불고기양념을 해주시는데요..요건 500g 양인데..좀 도톰한 고기는 100g에 한큰술을 사용했는데요건 부드럽고 얇팍해서 간장 4큰술 사용했답니다..간장양은 좀 조절하셔도 될거같아요~ 설탕이나 물엿으로 대체해도 되지만..일전에 배효소 담궈놓은게있어 단맛도 잡고 배즙 효과도 내주기위해배효소 4큰술 넣어주었어여~ 그외 불고기양념들~마늘,생강즙,청주,후추.. 고기에 양념이 잘베이게 조물조물 해주고..잠시 냉장고에 넣어두어여~ 냉장고속 자투리 야채들도 모아모아서함께 볶아여~ 달구어진팬에 고기올리고..볶아볶아주어여~ 고기가익으면 버섯도넣고..양파도넣고.. 잔파와 홍고추는 맨 마지막에 넣고살짜쿵만 볶아주세요~",피로회복,https://recipe1.ezmember.co.kr/cache/recipe/2015/04/09/3f71a80e8606bcfc3fca4c64f1fddd0a1_m.jpg
445,영양듬뿍 버섯밥,여러가지 버섯을 넣어 영양만점인 버섯밥~ 양념장에 슥슥비벼 먹으면 다른 반찬 필요 없지요~,[재료] 각종버섯  [양념] 간장  3T 물  1T 깨소금  고춧가루  청양고추  파 ,"버섯은 잘 씻어서 잘게 잘라 준비 하세요! 각종 버섯을 준비 해 주세요. 저는 마트에서 모듬 버섯을 한팩 샀어요. 새송이버섯, 느타리버섯, 표고버섯, 양송이버섯, 팽이버섯이 들어있어요. 쌀은 씻어서 30분 정도 담구고, 평소 밥 하는 물 보다 조금 물을 적게 잡았어요. 버섯에서 물이 나올꺼라서! 물을 평소보다 조금 덜!!! 잡고!! 버섯을 올려 취사! 쨔잔~~~ 구수한 버섯 향을 풍기며 완성된 버섯 밥! 이렇게만 먹으면 맛 없잖아요. 버섯 밥을 비벼 먹을 양념장을 만들어요.위 분량의 양념을 취향껏 가감하여 넣고 만들었습니다.",피로회복,https://recipe1.ezmember.co.kr/cache/recipe/2015/04/09/38c8ca57eef425591981cb5b109278bc_m.jpg
446,새콤매콤한 느타리버섯무침,느타리버섯은 식이섬유가 풍부하며 비타민과 식물성 페놀화합물들이 항산화작용으로 노화방지 및 피부미용에 좋다고 하는데요. 간단하게 만들어 먹을 수 있는 반찬 쫄깃쫄깃 새콤매콤한 느타리버섯무침 소개합니다.,[재료] 느타리버섯  300g 물  [양념] 고추장  1큰술 고춧가루  1작은술 양조간장  1작은술 소금  약간 매실액  1/2큰술 식초  1작은술 올리고당  1작은술 다진마늘  1/2큰술 다진파  1/2큰술 참기름  1작은술 통깨  1작은술,"느타리버섯은 끓는 물에 살짝 데친 후 찬물에 헹구어 체에 밭쳐 물기를 빼 줍니다. 분량의 양념장 재료 고추장, 고춧가루, 양조간장, 소금, 매실액, 식초, 올리고당, 다진 마늘, 다진 파를 넣어 골고루 섞어줍니다. 느타리버섯은 먹기 좋은 크기로 찢어서 그릇에 담고 양념장을 끼얹어줍니다. 간이 골고루 배도록 조물조물 무쳐줍니다. 참기름과 통깨를 넣어 다시 한번 버무려줍니다. 느타리버섯무침을 접시에 담고 통깨를 조금 뿌려냅니다.",피로회복,https://recipe1.ezmember.co.kr/cache/recipe/2015/04/02/8b439ce40c5b518a01a0d348193762831_m.jpg
447,마늘 소고기 샐러드,마늘의효능을 살펴보면 정말 마늘이 참 좋은 식재료라는걸 다시한번 느끼게 되는데요~ 만들기도 어렵지 않아 휘리릭 만들 수 있는 아주 간단하지만 영양듬뿍 마늘소고기샐러드 만나보세요~~,[재료] 소고기  100g 마늘  10~12개 양상추  적당량 기름  약간 허브솔트  약간 [양념] 간장  1큰술 다진양파  1큰술 발사믹식초  1큰술 포도씨유  1큰술 매실청  1작은술,"마늘,소고기를 준비해주시는데요~ 소고기는 구이용으롤 준비해주시면 된답니다~ 전 채끝살을 준비했어요~ 키친타올로 핏물을 제거한후에 먹기좋게 썰어주세요소고기에 허브솔트를 솔솔 뿌려 재워두시고 양념재료로 드레싱을 만들어 준비해주세요 마늘을 슬라이스 해 주시고달군팬에 기름을 두르고 마늘을 넣어 튀기듯 구워주세요 노릇노릇하게 구워주시는데요 팬에 기름의양을 최대한 적게하면서 튀기듯 구우는방법은 팬을 기울여서 튀기듯 구워주시면 기름도 적게 들고 마늘도 맛나게 튀길수 있답니다~ㅎㅎ 허브솔트에 재워 둔 고기를 달군팬에 센불에서 재빨리 구워주세요~~ 그릇에 양상추를 담고 소고기 올리고 구운마늘올리면 완성이랍니다~~",피로회복,https://recipe1.ezmember.co.kr/cache/recipe/2015/04/02/b15493db3d1f50fde2ad238333474afa1_m.jpg
448,마늘 명란비빔밥,간단하게 한 끼 해결할 수 있는 마늘 명란비빔밥 레시피,[재료] 밥  1공기 달걀  1개 명란젓  30g 마늘  4쪽 쪽파  1큰술 구운김  1/2장 [양념] 참기름  1/2큰술 들기름  1큰술 식용유  약간,"명란젓를 준비해 주세요. 마늘은 얇게 저미고, 쪽파는 채 썰어 주세요. 김은 직화로 구운 후 가위로 잘라 주세요. 명란젓은 칼로 가운데 칼집을 낸 후 칼등을 이용해서 살만 발라 내 주세요. 껍질은 버려 주세요. 명란젓 살과 쪽파, 참기름을 넣고 골고루 섞어 주세요. 달군 팬에 식용유를 두른 후 후 달걀 프라이를 만들어 주세요. 달걀 프라이를 덜어 낸 팬에 들기름 1큰술을 넣고 마늘을 노릇노릇하게 구워 주세요. 팬을 한쪽으로 기울여 구우면 마늘이 타지 않고 잘 구워집니다. 그릇에 밥을 담고 달걀 프라이와 구운 마늘 칩, 명란젓, 구운 김을 올려 주세요.",피로회복,https://recipe1.ezmember.co.kr/cache/recipe/2015/04/09/ea3d3cca20de47083239d8e87f9bbe5e1_m.jpg
449,환절기 면역력을 높여주는 마늘고구마 영양밥,간편하게 만들 수 있고 한끼 식사로 든든한 마늘고구마 영양밥,[재료] 백미  찹쌀  1줌 호박고구마  1개 은행  1줌 완두콩  1줌 마늘  10쪽 물  [양념] 진간장  3큰술 고춧가루  1큰술 송송 썬 쪽파  약간 다진 마늘  약간 통깨  약간 참기름  1큰술,"마늘과 호박고구마, 은행은 껍질 벗겨 씻은 후 호박고구마는 적당한 크기로 썰고 마늘은 반으로 편 썰어 줍니다. 백미와 찹쌀은 박박 문질러서 씻은 후 밥솥에 담고 불려 줍니다. 호박고구마, 마늘, 완두콩, 호박고구마를 얹어 줍니다. 물을 적당량 부은 후 전기밥솥 뚜껑을 닫고 백미 취사 버튼을 눌러 밥을 지어요. 분량대로 양념장을 만들어 고루 섞어줍니다. 마늘고구마영양밥을 그릇에 담고 양념장과 얼갈이배추된장국을 곁들여 내면 완성입니다.",피로회복,https://recipe1.ezmember.co.kr/cache/recipe/2015/04/22/4deddd48072e709c38ed329eeea1c2781_m.jpg
450,마늘 바지락 파스타,쉽게 구할수있는 바지락으로 깔끔하고 쉽게 만들 수 있는 마늘 바지락 파스타!,[재료] 바지락  마늘  스파게티면  청고추  홍고추  [양념] 생수  화이트와인  생강즙  후추  올리브오일 ,"바지락은 미리 해감을 시켜두어야 하는데요. 하루 전날 미리 소금물에 담궈 어두운곳에서 해감을 시켜도되고, 식초를 넣어 해감을 시켜도 됩니다. 해감된 바지락은 흐르는물에 잘씻어 건져두어요~ 스파게티면은 소금과 올리브오일을 조금 넣고 삶아줍니다. 잘 익은 스파게티면은 체에 받혀 그대로 식혀두세요. 달구어진팬에 올리브오일 두르고 마늘을 볶아 마늘향이 나게 해주시고 마늘이 익으면 바지락을 넣고 물을 100ml를 넣어주세요. 청주와 마늘 생강즙도 함께넣고 볶아주세요. 바지락이 입을벌리면서 익어가면 간을보고 바지락에서 나오는 간도 있으니 소금간은 약하게 해주시면 됩니다. 바지락이 익었다 싶을때 스파게티면을 넣어줍니다. 청고추 홍고추 넣고 한번 우르르 끓으면 마늘 바지락 파스타 완성!",피로회복,https://recipe1.ezmember.co.kr/cache/recipe/2015/04/13/24190b78ea74903b37c586b5fd8fb6241_m.jpg
451,대파 마늘 굴비구이,밥반찬으로 먹을 거라 시판 오리엔탈 소스를 조금 뿌려주었는데 맛이 좋아요~ 대파와 마늘향이 베인 부드러운 굴비살과 달큰하고 고소하게 씹히는 구운 마늘을 씹는 식감이 최고네요.,[재료] 굴비  튀김가루  마늘  대파  [양념] 오리엔탈소스 (생략가능) 포도씨유  적당량,자~ 샤방샤방 손질된 굴비를 준비하고.. 튀김가루나.. 프라이드 치킨용 가루 등을 이용해서 굴비에 밀가루 옷을 묻혀두어요~ 대파와 마늘을 준비해주는데요.. 달구어진 팬에 포도씨유를 두르고.. 마늘을 볶다가 마늘이 볶아지면 대파를 넣고 볶아주고.. 포도씨유에 마늘향과 파향이 베게 합니다.. 구워진 마늘과 대파는 키친타월에 올려 기름기를 빼두시고.. 튀김가루 묻힌 굴비는 대파와 마늘향 베인 기름에 구워줍니다.. 노릇하게 앞뒤로 구워주고.. 접시에 담아 내면 끝~ 미리 구워놓았던 마늘과 대파를 올려 맛을 한층 더 업그레이드 시켜주기.. 집에 있는 거니까 녹차가루도 솔솔~,피로회복,https://recipe1.ezmember.co.kr/cache/recipe/2015/04/04/6d6aa92deba77e318f00fa72da25baea1_m.jpg
452,돼지목살 생강조림롤 만들기,"생강을 갈아넣는 대신 생강원액과 액상생강을 넣어서 조림장을 만들고, 돼지고기를 졸여 야채를 돌돌 말아 맛을 낸 생강조림 롤~ 함께 만들어 보아요.",[재료] 돼지고기목살  200g 생강원액  1ts 후춧가루  식용유  양배추  1/8통 빨강파프리카  1/6개 노랑파프리카  1/6개 [조림장] 생강원액  2ts 생강(액상)  1Ts 간장  2Ts 맛술  2Ts 후춧가루 ,"돼지고기 목살은 0.5cm정도의 두께로 슬라이스해서 4장을 준비했어요. 여기에 생강원액과 후춧가루를 뿌려서 밑간을 해둡니다. 조림장 재료는 모두 섞어서 준비하고, 양배추는 얇게 채썰어주고, 파프리카도 얇게 채썰어서 준비했어요. 밑간해둔 고기를 달군 팬에 기름을 약간 두른후 넣어서 구워줍니다. 바싹 굽지 말고 앞뒤로 살짝 익혀서 구워주세요. 고기를 구워낸 팬을 한번 닦아주고, 거기에 조림장과 고기를 다시 넣어서 약불로 졸이듯이 구워주세요. 조림장이 거의 졸아들고 고기에 양념이 잘 배이면 불에서 내려줍니다. 고기를 펼쳐서 양배추와 파프리카를 얹어주고 단단하게 돌돌 말아서 고정을 시켜주세요. 이렇게 해서 접시에 담아 상에 내면 생강조림롤이 완성~",피로회복,https://recipe1.ezmember.co.kr/cache/recipe/2015/04/21/800cfb1b28c4debdac7c09a27df48be01_m.jpg
