recipeID,recipe_name,summary,ingredient_name,full_step,category,image_link
223,잔멸치전 만들기,"잔멸치는 단백질과 칼슘, 무기질이 풍부해서 어린이들의 성장발육과 여성들의 골다공증 예방에 아주 좋답니다. 오늘은 좀더 색다른 요리를 하나 만들어 보려고 하는데, 잔멸치를 이용한 잔멸치전입니다.",[재료] 잔멸치  1줌 깻잎  6장 당근  1토막 느타리 버섯  1줌 부침 가루  1컵 물  1/2컵 계란  1개 맛술  2큰술 포도씨유  적당량,"잔멸치는 넓은 접시에 깔아서 전자레인지에서 20초간 돌려서 비린내를 날려줍니다.전자레인지 그런 다음 체에 한번 털어주면 멸치가루가 밑으로 떨어져서 좀더 깔끔하답니다. 깻잎은 찬물에 5분 정도 담가서 흙이나 이물질들이 가라앉도록 한 후 서너번 헹궈서 물기를 제거합니다. 깻잎 꼭지를 자르고 반으로 자른 뒤에 굵게 채썰어줍니다. 느타리 버섯은 수돗물을 틀어놓고 거꾸로 잡고 재빨리 헹군 뒤에 물기를 짜줍니다. 밑둥을 자르고 버섯을 찢어준 후에 1cm 길이로 송송 썰어줍니다. 버섯은 멸치의 짠맛을 다소 중화시켜 주는 역할을 하고요. 당근도 채썰어 주는데, 되도록 곱고 가는 채가 좋답니다. 당근 채가 곱게 썰어졌는데, 당근이 큰 것은 채를 썬 뒤에 반을 잘라주는 것도 좋습니다. 반죽에 들어갈 재료 손질이 끝났구요. 부침가루 1컵에 물 반 컵,계란 1개, 맛술 2큰술을 넣어 고루 섞어줍니다. 거품기로 살살 멍울이 풀릴 정도로만 풀어줍니다. 너무 많이 저으면 끈기가 생겨서 전 반죽이 질겨집니다. 손질했던 재료들을 모두 넣어주시고요. 재료가 섞일 정도로만 스푼으로 살살 저어줍니다. 팬을 달군 후에 포도씨유를 넣어주고 한 스푼씩 떠서 동그랗게 모양을 만든 후에 앞뒤로 부쳐줍니다. 이 때 모자라는 기름은 보충을 해가며 구워주고, 자주 뒤집지 말고 각각 한번씩 뒤집어줍니다. 노릇한 색깔이 날 때 뒤집어주면 되구요.",골다공증,https://recipe1.ezmember.co.kr/cache/recipe/2015/05/24/34122f6729b0ed94381ddd0c4364a0fd1_m.jpg
224,간장쥐포볶음 레시피,짭쪼름하면서도 달달한 간장쥐포볶음 레시피 입니다.,[재료] 쥐포  멸치  1줌 청양고추  마늘  [양념] 간장  1T 올리고당  1T 참기름  약간 통깨  약간,"쥐포를 먹기 좋은 크기로 잘라 준비합니다. 간장쥐포볶음은 조리 후에 양이 줄어드니 넉넉히 준비해둡니다. 멸치는 머리를 떼어내고 반으로 갈라 내장을 제거합니다, 마늘과 청양고추 1개를 썰어 준비합니다. 팬에 기름을 살짝 두른 후 마늘을 먼저 볶아 마늘 향을 내다가 준비한 분량의 양념을 넣어 끓여줍니다. 양념이 어느정도 끓어 오르면 준비해둔 쥐포와 멸치를 넣어 빠르게 볶아내면 간장쥐포볶음이 완성됩니다.",골다공증,https://recipe1.ezmember.co.kr/cache/recipe/2015/05/16/a1eb11b9fa2eaf1d3635f12a7af8e1a41_m.jpg
225,오븐이 필요 없는 케이크 '우유스팀케이크',주말 간식으로 참 좋아요 ~ 버터가 들어가지 않아서 건강에 좋구요 오븐을 사용하지 않고 찜으로 간편하게 즐길수 있는 케이크 있는 재료를 이용해서 집에서 간단하게 즐길수 있는 간식 이랍니다.,[재료] 박력밀가루  200g 우유  220g [양념] 설탕  4.5T 소금  약간 베이킹파우더  2t 은박컵 6개,"볼에 우유와 설탕, 소금을 넣어 잘 섞어 주세요 그런 다음 분량의 베이킹파우더를 넣고 밀가루를 넣고 고루 섞어 주세요 완성 입니다. ^^ 준비한 은박틀에 절반 정도로 반죽을 담아 주세요 더 부드러운 스팀케이크를 원하신다면 우유를 더 넣으셔도 좋아요 ~ 반죽을 담고 끓어 오르는 찜기 속에 10분간만 찌면 완성 입니다. 완성 입니다. 이거 만드는데 정말 찌는 시간빼고 5분도 안걸려요 ~^ 아주 간단하게 집에서 담백하게 드실수 있답니다. 따끈할때 먹으면 더 맛있는 우유스팀케이크 입니다.",골다공증,https://recipe1.ezmember.co.kr/cache/recipe/2015/04/16/199880064ec902465cb5487d1942950e1_m.jpg
226,멸치 강정,해바라기씨를 넣어 더 고소한 멸치강정입니다.,[재료] 해바라기씨  2+1/2컵 낭장망 멸치  1/3컵 피칸  10개 볶은콩가루  조금 [양념] 물엿(조청)  2+1/2큰술,"먼저 멸치를 팬에 볶아 주는데요. 해바라기씨는 기름기 없는 팬에 중간불로 달달 볶아 주고요. 견과류 볶아내고 멸치도 달달 바삭하게 볶아 주세요. 해바라기씨와 피칸, 멸치를 각각 따로 볶아 줘야 맛있고 잘 볶아집니다. 다 볶아진 것을 넓은 쟁반에 놓고 열을 식히며 세가지를 섞어 줍니다. 팬에 조청을 바글바글 잠시 끓여주고 불을 끄세요. 조청에 볶아진 멸치와 해바라기씨를 넣고 섞어 주세요. 도마에 볶은 콩가루를 1찻술 정도 가볍게 뿌려주고 멸치를 부어서 판판하게 펼쳐줍니다. 뜨거울 때 칼로 가장자리를 반듯하게 하고 위에는 작업하기 좋도록 비닐로 덮어 판판하게 눌러주었어요. 잠시 후에 굳은 강정을 칼로 잘라 주세요. 톱질하듯이 하지말고 칼을 수직으로 그대로 내려서 깔끔하게 잘라 주세요.",골다공증,https://recipe1.ezmember.co.kr/cache/recipe/2015/06/10/43237ef518d9eb95026b5050dd4004c31_m.jpg
227,고추멸치 후리카케 만들기,청양고추와 멸치의 궁합이 환상적인 어른용 후리카케입니다.,[재료] 청양고추  멸치  [양념] 조선간장  깨 ,"멸치는 중간크기의 볶음용으로, 머리 떼어내고 똥 빼내서 손질하심 됩니다. 손질한 멸치를 잘게 잘라주세요. 칼보다는 가위가 좀더 편하실 겁니다. 그다음 매운고추는 꼭지를 떼어내고 잘 씻어주세요. 반갈라 잘게 썰어주세요. 잘게 썬 멸치와 청양고추는 팬에 넣고 볶아줍니다. 아무것도 넣지 않고 중불에서 덖어주듯 볶아주세요. 어느정도 볶다가 조선간장을 넣어주면 됩니다. 깨도 듬뿍 넣어주시고요. 조금만 더 볶아주심 완성이랍니다. 완성된 후리카케는 따뜻한 밥위에 양껏 뿌려먹으면 됩니다.",골다공증,https://recipe1.ezmember.co.kr/cache/recipe/2015/05/14/4b138b363efe193a0a0a93d9c161693e1_m.jpg
228,귀리죽 만들기,아침에 우유과 귀리를 혼합하여 죽을 끓여서 복용하면 영양보충은 물론 건강에도 좋다고 합니다.,[재료] 귀리  1컵 물  5컵,"귀리는 물에 담가 3시간정도 불려줍니다. 불린 귀리는 믹서에 넣고 물2컵을 붓고 갈아줍니다. 아이이유식으로 귀리죽을 하실 분들은 완전히 귀리를 갈아주시고, 성인기준 씹히는 식감을 원하시는 분들은 성글성글 갈아주세요. 냄비에 물을 3컵정도 붓고 블렌딩한 귀리도 함께 넣어줍니다. 센불에서 5분정도 끓여줍니다. 바닥에 눌러붙으면 안되니 살살 저어가며 끓입니다. 중불이나 약불로 바꿔 30분정도 다시 끓여줍니다. 계속 저어가며 귀리죽이 바닥에 눌러붙지 않게 주의해주세요. 물의 점성이 높아질정도로 물이많이 줄었다고 생각될 때, 불을 꺼주면 됩니다.",골다공증,https://recipe1.ezmember.co.kr/cache/recipe/2015/05/17/65d3632008b57bde430ad165adcf5d8c1_m.jpg
229,귀리치즈빵,고소한 담백함의 극치 더블치즈스틱/귀리치즈빵,[재료] 강력분  320그램 귀리가루  80그램 설탕  50그램 소금  4그램 드라이이스트  6그램 우유  275그램 버터  40그램 파마산치즈가루  스트링치즈 ,제빵기에 반죽날을 끼우고 우유->강력분->귀리가루->설탕/드라이이스트/소금을 서로 닿지 않게 넣어준다. 제빵기 반죽코스를 선택하여 1-2분 쯤 가루가 보이지 않는 시점에 뚜껑을 열어 실온상태의 버터를 넣고 다시 뚜껑을 덮어준다. 반죽이 완료되면 제빵기에서 틀을 꺼낸다. 반죽을 양손으로 매만져서 동그랗고 매끄럽게 만든다. 반죽을 담고 그 위에 랩이나 젖은 면보를 씌운 후 따뜻한 곳에서 1시간 정도 1차발효를 한다. (랩을 씌울 경우 숨구멍을 몇군데 뚫어준다) 손가락에 밀가루를 묻혀 반죽의 가운데를 지렀을 때 그대로 남아있으면 1차발효 완료. 가볍게 눌러 가스를 빼주고 10분정도 휴지타임을 갖는다.(이 과정을 생략하면 성형할 때 어려움을 겪는다) 반죽을 매만져서 다시 표면을 동그랗고 매끈하게 만든다. 반죽을 약 120그램씩으로 분할한다. 반죽을 동글리기 한 후 다시 랩(구멍 뚫어줌)이나 젖은 면보를 덮고 20분 정도 중간 발효를 한다. (중간발효는 빵모양을 잘 나오도록 하기 위한 것) 반죽을 밀대로 밀고 뒤집어서 가로로 길게 놓은 후 치즈를 올린다. 치즈를 감싸면서 반죽을 돌돌 말아올리고 끝부분은 꼭꼭 눌러붙여 반죽이 풀리지 않도록 꼼꼼하게 봉한다. 반죽을 굴려서 모양을 정리한 후(물론 두 손으로!) 붓으로 물을 바른다. 오븐팬에 왁스페이퍼나 테프론시트를 깔고 파마산치즈가루를 펼쳐 담고 반죽을 굴리면서 치즈가루를 골고루 묻힌다음 이음새가 밑으로 가게 한 후 40분 정도 2차발효를 한다. 발효가 끝나면 칼집을 내고 180도로 예열한 오븐에서 12분 정도 굽다가 팬의 위치를 바꾸어 5분 정도 더 굽는다.오븐,골다공증,https://recipe1.ezmember.co.kr/cache/recipe/2015/05/13/b1765b30b06168cd82f3cb2f8f2460b21_m.jpg
230,시래기 고등어조림 만들기,된장으로 맛을 낸 담백하고 구수한 시래기 고등어조림 레시피를 소개합니다~!,[재료] 시래기  1줌 고등어  2토막 [양념] 생강가루  0.5 다진마늘  1 후추  조금 된장  1,"시래기 고등어조림에 들어가는 시래기는 불렸다가 한 번 삶아서 물기를꽉 짜준뒤에 숭덩숭덩 잘라서 준비합니다. 냄비에 시래기를 바닥에 깔고 고등어 두 토막을 올린뒤에 후추 조금 뿌리고,다진마늘도 올려줍니다. 육수에 넣어줄 된장은 집된장이라서 망으로 한 번 걸러 된장국물만준비해 넣어 주었어요.(멸치다시마육수나 해물육수가 있다면 육수를 활용해서 깊은맛을 내도 좋아요) 된장을 푼 물까지 부어주면 준비 끝.이제 냄비 뚜껑을 닫고 보글보글 끓여주면 됩니다 시래기가 퍼지면서 국물이 졸아들면 중간중간 물을 조금씩 부어가며졸여주세요. 부족한 간은 소금으로 맞춰 주시고요.",골다공증,https://recipe1.ezmember.co.kr/cache/recipe/2015/05/22/b61040ef083c7288bf985a980343a7711_m.JPG
231,보굴보굴 굴 차우더,미역과 굴이 들어가 산모인 아내와 아이들에게 최고인 영양식! '냉장고를 부탁해'의 보굴보굴 굴 차우더에 도전합니다!,[재료] 굴  미역  마늘  버터  밀가루  우유  [양념] 후추  소금 ,"냉동 굴을 해동시켜 끓는 물에 끓입니다. 냄비에 참기름, 마늘, 미역을 볶습니다. 굴육수 넣고 끓여줍니다. 루와 베샤멜 소스를 만들건데요~ 루는버터와 밀가루를 1:1로 넣어 타지 않게 약불로 만들어 주세요. 베샤멜 소스는 루에 우유 넣고 빨리 저어 만듭니다. 끓인 미역과 베샤멜 소스를 넣고 믹서기에 갈아줍니다. 양파를 볶고 굴을 넣어 조금 더 볶습니다. 간 미역과 볶은 굴에 부어서 다시 끓여주고 후추와 소금 조금 넣어 간을 해주면 끝.",골다공증,https://recipe1.ezmember.co.kr/cache/recipe/2015/05/15/0dda00610df1be77c0718789204adf111_m.JPG
232,연어김밥 만들기,나들이 도시락으로 좋은 연어김밥 입니다.,[재료] 밥  4공기 김밥용 김  4장 상추  깻잎  무  당근  어묵  (판) 계란  3개 연어통조림  [양념] 참기름  1큰술 검은깨  1큰술 소금  배합초  올리브오일  소금  간장  올리고당  1.5큰술 물  1.5큰술 다진마늘  1작은술 참기름  소금  마요네즈  1큰술 후춧가루 ,"무는 채 썰어 배합초에 절여줍니다. 중간중간 뒤적이며 낭창낭창해질때까지.. 당근은 채 썰어 볶아줍니다.(+ 올리브유와 소금 약간) 상추와 깻잎은 깨끗이 씻어 물기 털어주고. 팬에 다진마늘,간장, 올리고당, 물을 넣고 끓어오르면 채 썰은 어묵을 넣어 볶듯 조려줍니다. 달걀지단도 만들고. 통조림 연어는 기름기를 뺀 뒤 마요네즈와 후추를 넣어 포슬포슬하게 섞어줍니다. 밥은 참기름과 검은깨, 소금 약간 넣어 골고루 섞어준 뒤, 준비한 모든 재료를 넣고 돌돌 말아주면. 연어김밥 완성.",골다공증,https://recipe1.ezmember.co.kr/cache/recipe/2015/05/13/b5a10719ccefa39005db1748918c9ad91_m.jpg
233,참치요거트샐러드 만들기,맛도 좋고 영양도 좋아요~ 상큼한 샐러드 만드는 법을 소개합니다!,[재료] 양상추  바나나  1개 참치  파프리카  콘옥수수  건포도  얼음물  [양념] 요거트드레싱 ,"양상추,파프리카는 깨끗히 씻어서 먹기좋게 잘라서 얼음물에 5분정도 담가 두었다가 사용하면 훨씬 아삭하고 싱싱한 샐러드를 먹을 수 있어요 참치는 기름을 되도록 제거해서 준비해주세요. 전 2큰술 넣었는데 너무 많이 넣으면 짤 수 있으니 주의하세요. 아삭한 야채를 완성접시에 올리구요 바나나도 하나 썰어서 올리구요 상큼한 맛을 좋아 하시면 사과 넣어도 좋겠어요. 그리고 참치 넣고 콘 옥수수까지 얻어주세요 견과류로 마무리 할랬는데 다 먹어서 건포도 몇알.그리고 요거트 드레싱 뿌려주면 완성이랍니다.",골다공증,https://recipe1.ezmember.co.kr/cache/recipe/2015/05/06/595722cba532b272bd9a574610bed2ef1_m.jpg
234,리코타치즈 만드는 법,생크림없이 집에서 쉽게 만드는 리코타치즈입니다.,[재료] 우유  레몬즙  소금  설탕 ,"먼저 우유 700ml를 준비해서 냄비에 넣어주시고 소금 살짝 넣어서 약불에 올려주세요. 우유에 설탕3t, 레몬즙 3t을넣고 많이 젓지마시고 주걱으로 3~4번 젓고 그대로 약불로 두세요 20분쯤 지나면 이렇게 슬슬 분리되기 시작하는데요. 그럼 그때 불을 끄세요. 면보위에 순두부같이 몽글몽글한 치즈를 살살 부어주세요. 치즈의 물기를 빼주세요.",골다공증,https://recipe1.ezmember.co.kr/cache/recipe/2015/06/09/8c789b7542a000cdc76cdf3add9832f51_m.jpg
235,칼슘과 철분이 풍부한 양미리 조림,"양미리는 소금구이나 조림으로 만들어 먹는데요. 오늘은 단백질이 풍부한 양미리와 무, 갖은 양념으로 조림반찬을 만들어 보려고 준비했습니다. 겨울이 제철인 고소하고 담백한 양미리조림 소개합니다.",[재료] 양미리  20마리 무  450g 풋고추  2개 대파  1뿌리 통깨  물  [양념장] 양조간장  3큰술 고춧가루  2.5큰술 올리고당  1큰술 맛술  1큰술 다진생강  1작은술 다진마늘  1/2큰술 물 ,양미리는 머리와 꼬리를 자르고 흐르는 물에 깨끗하게 씻은 후 반으로 썰어주세요. 무는 흐르는 물에 씻은 후 껍질을 제거하고 도톰하게 썰어주세요. 대파는 껍질을 벗겨 씻은 후 어슷 썰고 풋고추는 꼭지를 제거하고 흐르는 물에 씻은 후 어슷 썰어주세요. 분량의 양념재료로 양념장을 만들어주세요. 냄비에 무를 깔고 풋고추를 조금 올린 후 물을 붓고 양념장을 조금 끼얹어서 냄비 뚜껑을 덮고 익혀주세요. 무가 투명하게 익으면 양미리와 풋고추를 올려 양념장을 끼얹어서 조려주세요. 한소끔 끓으면 불을 줄이고 간이 골고루 배도록 중간중간 양념장을 끼얹어 주면서 조려주세요. 양념장 국물이 자작자작해지면 대파를 얹고 냄비뚜껑을 덮은 후 한소끔 끓으면 불에서 내려요.,골다공증,https://recipe1.ezmember.co.kr/cache/recipe/2015/05/23/fb4b08e31077de0fae8876f230a0f5831_m.jpg
236,칼칼한 꽁치 김치찌개 레시피,날씨 참 추워요~ 비가 와서 그런가 그래서 칼칼~하고 맛있는 꽁치 김치찌개 한번 만들어봤어요.,[재료] 꽁치캔  1통 김치  두부  청양고추  양파  대파  [양념] 들기름  고추장  1.5T 고추가루  1T 매실청  1T,"먼저 냄비에 들기름붓고 냄비를 살짝 가열해주세요. 냄비가 열이 좀 받으면 김치 송송 썰어넣고 잘 볶아주시다가 양파 썰어서 넣고 살짝 볶아주시구요. 그 다음 고추장1.5, 고추가루1, 매실청1 넣고 볶아주세요.냄비 타지않게 뒤적뒤적해주세요. 그 다음 물 부으세요.사진만큼 재료 잠기게~ 뭐 넣을꺼 없나 뒤지다가버섯 발견해서 같이 넣어봤어요. 안넣어도 무방합니다. 이렇게 색깔이 곱게 변하기 시작하면파도 쫑쫑 넣구요 꽁치를 넣습니다. 꽁치들 푹푹 잠기게 찌개속으로 밀어넣어주시구요, 꽁치게 찌개물이 베기 시작해서주황빛이 돌면 두부도 넣구요. 두부도 예쁘게 찌개색이 베어나면요청양고추 쫑쫑 썰어넣어서 보글보글~ 완성!",골다공증,https://recipe1.ezmember.co.kr/cache/recipe/2015/05/19/1c67bf2d9a88d5ae52d6158777e036451_m.jpg
237,부들부들 우유푸딩,부들부들 부드럽고 달콤한 푸딩입니다.,[재료] 우유  500ml 판젤라틴  6장 플레인요거트  2개 과일  [양념] 설탕  3TS 메이플시럽  블루베리시럽 ,"젤라틴은 찬물에 10분정도 불려 주세요. 우유는 각각 200, 300으로 나눠 주시구요. 우유 200ml에는 요거트를 섞어주세요. 우유 300ml는 설탕을 넣고 중탕하여 따뜻하게 데워주세요, 불려놓은 젤라틴도 물끼를 꼭 짜 함께 녹여줍니다. 넓은 그릇에 요거트섞은 우유와, 설탕과 젤라틴을 녹인 우유를 함께 잘 섞어 한김 식혀주세요. 예쁜 그릇과 병에 담아 냉장고에 3시간이상 굳히시면 완성입니다.",위 건강,https://recipe1.ezmember.co.kr/cache/recipe/2015/07/29/df6d9c0778cf76c21289ba55b15e895f_m.jpg
238,오븐이 필요 없는 케이크 '우유스팀케이크',주말 간식으로 참 좋아요 ~ 버터가 들어가지 않아서 건강에 좋구요 오븐을 사용하지 않고 찜으로 간편하게 즐길수 있는 케이크 있는 재료를 이용해서 집에서 간단하게 즐길수 있는 간식 이랍니다.,[재료] 박력밀가루  200g 우유  220g [양념] 설탕  4.5T 소금  약간 베이킹파우더  2t 은박컵 6개,"볼에 우유와 설탕, 소금을 넣어 잘 섞어 주세요 그런 다음 분량의 베이킹파우더를 넣고 밀가루를 넣고 고루 섞어 주세요 완성 입니다. ^^ 준비한 은박틀에 절반 정도로 반죽을 담아 주세요 더 부드러운 스팀케이크를 원하신다면 우유를 더 넣으셔도 좋아요 ~ 반죽을 담고 끓어 오르는 찜기 속에 10분간만 찌면 완성 입니다. 완성 입니다. 이거 만드는데 정말 찌는 시간빼고 5분도 안걸려요 ~^ 아주 간단하게 집에서 담백하게 드실수 있답니다. 따끈할때 먹으면 더 맛있는 우유스팀케이크 입니다.",위 건강,https://recipe1.ezmember.co.kr/cache/recipe/2015/04/16/199880064ec902465cb5487d1942950e1_m.jpg
239,[조개관자요리]관자 버터구이 만들기,"제일 쉽고, 만만한 관자 버터구이를 만들어봤어요^_^",[재료] 조개관자  후추  미림  양파  통마늘  파프리카  허브솔트  버터 ,"조개관자를 미림과 후추를 넣은후에 20분정도 재워주세요.조개관자가 아무리 완소재료라고 하더라도 비린맛이 느껴진다면 완소에서 극혐의 음식재료로 변신할수 있으니 비린맛 제거를 위해 미림과 후추를 넣어줍니다. 야채는 집에 있는 재료 아무거나 사용하셔도 상관없지만전 집에 양배추와 양파, 파프리카가 있어서 사용했구요이 모든 재료가 없으면 통마늘만 가지고 하셔도 상관없어요 후라이팬에 버터를 큼직하게 썰어서 넣고 바로 통마늘을 넣어서 버터와 함께 튀겨주세요이때 냄새가 환상이랍니다^_______^ 통마늘이 노릇노릇하게 구워지면, 야채를 모두 투척해서 같이 볶아 주세요 야채를 넣고, 관자를 넣어주세요. 보통은 굴소스를 이용해서 요리하시지만, 전 이번에 굴소스느님의 도움을 받지 않기로 했어요 ㅋㅋ대신, 굴소스님과 막강파워를 가진 허브솔트를 이용하여 간을 내줍니다. 조개관자가 투명에서 불투명으로 바뀌면 다익은거예요^_^",위 건강,https://recipe1.ezmember.co.kr/cache/recipe/2015/10/07/03332a5c83bc548ef847e8304305ac9f1_m.jpg
240,과콰몰리,"구아카몰리는 멕시코 소스의 한 종류로 구아카는 ‘아구아카테’라는 아보카도의 뜻과 멕시코의 원주민이 소스를 일컫는 ‘몰리’가 합쳐져서 붙여진 이름이라고 해요. 
나초에 찍어서 드시거나 샌드위치등을 만드실 때 소스로 사용하시면 고소하고 부드러운 맛을 더해준답니다. 아보카도를 사실 때는 녹색에서 검은색으로 약간 변하고 손으로 쥐었을 때 탄력성이 있는 것을 고르시면 좋아요.",[재료] 아보카도(잘익은)  2개 라임  1개 토마토  1개 적양파  1/2개 할라피뇨  1개 다진마늘  1작은술 소금  약간,"재료를 준비해주세요. 잘 익은 아보카도는 반을 갈라서 씨를 빼고 속을 파내어 주세요. 토마토는 물기가 많은 씨 부분은 사용하지 않고 토마토의 살 부분을 잘라내어 다져주세요. 볼에 아보카도를 넣고 으깨어 주신 후 잘게 다진 토마토, 양파, 할라피뇨, 라임즙을 넣고 고루 섞다가 소금을 넣어 간을 해주세요. 만들어진 과콰몰리는 나초를 찍어서 드시거나 샌드위치소스로 사용해보세요.",위 건강,https://recipe1.ezmember.co.kr/cache/recipe/2015/11/02/9ee6697aae7df8b0b7a22bedfbc1d17b1_m.jpg
241,달걀지단 치즈롤 샌드위치,색다른 달걀지단치즈롤샌드위치 만들어볼게요,[재료] 달걀  2개 당근  20g 식빵  2장 슬라이스치즈  1장 [양념] 소금  약간 기름  약간 마요네즈  2작은술,"달걀은 노른자,흰자 분리한후 알끈제거후에 소금을 약간씩 넣어 준비해주세요 식빵은 가장자리를 잘라낸후에 밀대로 밀어 준비해주세요 당근은 잘게 썰은후에 달걀흰자에 넣고 섞어주세요 후라이팬에 기름을 두르고 키친타올로 넓게 펴 바른후에 약한불에서 달걀노른자지단과 달걀흰자지단을 부쳐주세요 달걀지단을 부칠때에는 약한불에서 부쳐주시고 달걀윗면색이 선명해질때까지 익힌후에나무젓가락으로 가장자리를 들어 뒤집어 주시면 된답니다 달걀노른자,흰자지단을 식빵크기의 반으로 잘라주시고 식빵위에 마요네즈를 펴바른후에달걀흰자,노른자,치즈를 올리고 돌돌 말아주신후에랩으로 한번 감싸 잠시 놓아둔후에썰어 맛나게 드시면 됩니다",위 건강,https://recipe1.ezmember.co.kr/cache/recipe/2015/06/08/1f3351f885b5543fee429af577f3ba6f_m.jpg
242,감자수프,"남편과 가족을 위해서 따뜻한 감자수프를 준비해보세요.
담백한 감자와 달콤한 양파, 생크림이 어우러진 감자수프는 고소하고 부드러울 뿐만 아니라 간편하고 부담이 없어서 아침 식사 대용으로 좋아요.",[재료] 감자(중간크기)  3개 양파  1개 생크림  1컵 치킨스톡큐브  1/2개 (생략가능) 파마산치즈  2큰술 소금  약간 후추  약간 베이컨  2장 다진파슬리  1/2작은술,"재료를 준비해주세요. 감자와 양파는 깨끗하게 씻은 후 껍질을 벗기고 냄비에 물과 함께 넣고 삶아준 후 건져내어 주세요. 이때 감자와 양파 삶은 물은 약 1컵 가량을 남기고 버려주세요. 삶은 감자와 생크림 1컵을 블랜더로 곱게 갈아주세요. 삶은 양파는 잘게 다진 후 냄비에 기름을 조금 넣고 볶다가 2번의 감자와 생크림을 넣어주세요 수프가 너무 되직하면 양파와 감자 삶은 물 약 ½컵~1컵을 넣어 농도를 묽게 맞춰준 후, 치킨스톡 ½개를 넣고 끓여주세요. 중간불에서 수프를 저어가며 걸쭉하게 끓이다가 파마산치즈를 넣고 소금, 후추로 간을 해주세요. 베이컨은 팬에 바짝 구워서 기름을 제거하고 잘게 잘라 주시고 파슬리는 다져주세요. 수프가 끓으면 그릇에 담고 베이컨과 다진 파슬리를 뿌려주세요.",위 건강,https://recipe1.ezmember.co.kr/cache/recipe/2015/11/04/de15576420c295eb0e8210007de3efa11_m.jpg
