recipeID,recipe_name,summary,ingredient_name,full_step,category,image_link
649,새콤달콤 상큼함까지 더해진 토마토열무국수,"건강한 토마토와 한창 맛깔나는 열무김치를 이용해 새콤달콤 상큼한 토마토열무국수를 만들어보았는데요.
무더위에 달아난 입맛을 제대로 살려줄수있는 별미랍니다.",[재료] 토마토  열무김치  소면  [양념] 고추장  진간장  고춧가루  설탕  식초  깨소금  참기름 ,"노화방지와 항암에도 효과적이라 알려져있는 몸에좋은 토마토는 는 빨간 완숙토마토가 라이코펜 함유량이 높고 라이코펜은 익혀 먹을수록 흡수율이 더 높아진다고 합니다. 토마토를 4~8등분하여 씨부분을 분리하신뒤 과육을 채썰어준비하시고 씨부분은 잘게 다져 준비해주세요. 진간장, 고추장, 고춧가루, 설탕, 식초에 다져놓은 토마토의 씨부분을 함께넣고 섞어 양념장을 만들어주었어요. 열무김치도 쫑쫑썰어 준비했고요. 국수는 끓는물에 소금을 넣고 삶다가 훅 끓어오를때 찬물을 한컵 더 부어 면을 익혀주신다음 흐르는물에 충분이 헹궈주셔야 쫄깃한 면발을 맛보실수가 있답니다. 물기를 뺀 국수에 열무김치, 채썰어놓은 토마토과육과 양념장을 넣어 살살 버무려줍니다. 마지막으로 깨소금과 참기름을 넣어 고소함을 살려 마무리 해줍니다. 토마토의 상큼함이 살아있는 새콤달콤 토마토열무국수가 완성되었어요.",노화방지,https://recipe1.ezmember.co.kr/cache/recipe/2015/06/22/5a5d9ca8fdaf6894a036b0cf6f4a4eb81_m.jpg
650,미역초무침,"청정바다에서 생산되는 품질 좋은 진도미역으로 건강한 밥상을 차리고 있는 요즘인데요. 산모에게 좋은 미역은 칼슘과 식이섬유소가 풍부하며 미역에 들어있는 요오드는 피를 맑게 해 준다고 하지요. 또한 알긴산이라는 성분은 비만방지에 도움을 주며 변비예방에도 좋다고 합니다. 오늘은 진도미역과 양파, 홍고추, 양념장으로 만든 새콤매콤한 반찬! 미역초무침 소개합니다.",[재료] 건미역  6g 양파  1/3개 홍고추  1/2개 [양념] 고추장  2큰술 매실액  2큰술 식초  2큰술 올리고당  1큰술 맛술  1큰술 다진 마늘  1작은술 통깨  1큰술 참기름  1작은술,"건미역은 물에 충분히 불린 후 박박 문질러서 씻은 다음 끓는 물에 살짝 데쳐서 찬물에 헹구어 먹기 좋은 크기로 썰어서 물기를 빼 줍니다 양파는 껍질을 벗겨 씻은 후 채 썰고 홍고추는 꼭지를 제거하고 흐르는 물에 씻은 후 어슷 썰어줍니다. 분량의 양념장 재료 고추장, 매실액, 식초, 올리고당, 맛술, 다진 마늘, 통깨를 넣어 고루 섞어줍니다. 그릇에 미역, 양파, 홍고추, 양념장을 붓고 간이 고루 배도록 조물조물 버무린 후 참기름을 넣어 다시 한 번 버무려줍니다.",노화방지,https://recipe1.ezmember.co.kr/cache/recipe/2015/05/26/4ba8eff834b014a727ef4fcef21660261_m.jpg
651,미역초무침,"청정바다에서 생산되는 품질 좋은 진도미역으로 건강한 밥상을 차리고 있는 요즘인데요. 산모에게 좋은 미역은 칼슘과 식이섬유소가 풍부하며 미역에 들어있는 요오드는 피를 맑게 해 준다고 하지요. 또한 알긴산이라는 성분은 비만방지에 도움을 주며 변비예방에도 좋다고 합니다. 오늘은 진도미역과 양파, 홍고추, 양념장으로 만든 새콤매콤한 반찬! 미역초무침 소개합니다.",[재료] 건미역  6g 양파  1/3개 홍고추  1/2개 [양념] 고추장  2큰술 매실액  2큰술 식초  2큰술 올리고당  1큰술 맛술  1큰술 다진 마늘  1작은술 통깨  1큰술 참기름  1작은술,"건미역은 물에 충분히 불린 후 박박 문질러서 씻은 다음 끓는 물에 살짝 데쳐서 찬물에 헹구어 먹기 좋은 크기로 썰어서 물기를 빼 줍니다 양파는 껍질을 벗겨 씻은 후 채 썰고 홍고추는 꼭지를 제거하고 흐르는 물에 씻은 후 어슷 썰어줍니다. 분량의 양념장 재료 고추장, 매실액, 식초, 올리고당, 맛술, 다진 마늘, 통깨를 넣어 고루 섞어줍니다. 그릇에 미역, 양파, 홍고추, 양념장을 붓고 간이 고루 배도록 조물조물 버무린 후 참기름을 넣어 다시 한 번 버무려줍니다.",노화방지,https://recipe1.ezmember.co.kr/cache/recipe/2015/05/29/061701ff47f3fa867850488257f54c5c1_m.jpg
652,식어도 물기없는 맛타리버섯 볶음 만드는법,"맛타리 버섯은 느타리버섯과 생김새가 비슷하지만, 색이 더 짙고 맛은 더좋은 친환경버섯 이에요. 정식명칭은 애느타리버섯이며 비타민 등 무기질이 풍부한 건강식품 중의 하나 입니다.",[재료] 맛타리버섯  200g 파프리카  피망  양파  [양념] 소금  오일 ,"맛타리 버섯은 가닥가닥 떼어 주세요. 끓는 물에 소금을 조금 넣고. 버섯을 넣은뒤 30초 정도 데쳐줍니다. 데친 버섯은 재빨리 찬물에 헹군뒤, 물기를 꾹 눌러 짜듯이 제거해 줍니다. 냉장고의 자투리 야채는 길이로 채썰어 줍니다. 저는 파프리카, 피망, 양파를 사용 하였는데 양배추, 당근 등을 넣어도 좋아요. 썰은 뒤에 야채(한줌)에 소금. 오일을 조금씩 넣고 살짝 버무려 밑간을 해둡니다. 물기를 꾹 차둔 맛타리 버섯(200g- 1팩)에 소금. 후추. 다진마늘. 오일을 조금씩 넣고 버무려 밑간을 해둡니다. 밑간을 해둔 맛타리 버섯은 달군 후라이팬에 넣고 센불에서 볶아줍니다. 이때, 센불에서 재빨리 볶아내서야 물기가 생기는 것을 방지할 수 있어요. 버섯을 볶아낸 후에 접시에 잠시 옮겨두고 야채도 재빨리 볶아냅니다. 따로 볶아낸 버섯과 야채를 소금으로 간하여 조물조물 무치면 됩니다. 참기름과 깨로 마무리 하시면 되고요. 꼬들꼬들 거리는 맛타리버섯 볶음 한접시면, 오늘 밥상이 든든해 보일것 같습니다. 깔끔하게 볶아낸 맛타리 버섯볶음. 오늘의 밥도둑 입니다.",노화방지,https://recipe1.ezmember.co.kr/cache/recipe/2015/04/16/fcb7ad3725a6b5876775fd9c91921bed_m.jpg
653,파프리카 크랩맛살 꼬치구이,아이들도 좋아하고 피부미용과 노화방지에 좋은 파프리카 크랩맛살 꼬치구이입니다.,[재료] 노란색 파프리카  1/2개 크랩 맛살 작은것  3개 새송이 버섯  1개 식용유  약간 [양념] 소금  약간,"크랩 맛살을 네모로 자르고, 파프리카도 맛살과 같은 크기로 잘라줍니다. 새송이 버섯은 약간 굵게 잘라서 파프리카 보다는 약간 큰 네모로 잘라줍니다. 예열된 오븐에 호일을 깔고 기름을 살짝 발라 준 다음 재료를 올려놓고, 소금 약간 뿌려주어 180도 에서 약 10분간 구워줍니다.오븐 꼬치나 요지에 세가지를 하나씩 순서대로 꽂아주면 완성 ^^",노화방지,https://recipe1.ezmember.co.kr/cache/recipe/2015/08/11/4de880a7f76b50952d00193f3715856c_m.jpg
654,아삭하고 맛있는 해남세발나물무침,"노화방지, 다이어트에 좋은 해남세발나물로 무침을 만들었어요.",[재료] 해남세발나물  200g [양념] 된장  1큰술 고추장  1큰술 참기름  1큰술 깨소금  1/2큰술 다진마늘  1/2큰술,세발나물은 물에 한번 살짝 헹구어주세요. 끓는물에 소금을 약간 넣고 세발나물을 넣어서 뒤집었다 꺼내는 정도로 아주 빨리 데쳐서 찬물에 헹궈주세요. 물기를 꼭 짜서 양념을 넣어 조물조물 무쳐냅니다. 간은 좀 약하게 하셔야 되요. 약간 짠맛이 나거든요.,노화방지,https://recipe1.ezmember.co.kr/cache/recipe/2015/06/18/4e8e4466e3bfe5ef73c1830cd1718702_m.jpg
655,건강에 좋은 렌틸콩밥,건강에 좋은 렌틸콩으로 밥을 지어볼게요.,[재료] 쌀  1컵 렌틸콩  2큰술 물  1컵 (1인분 ),"쌀 1컵은 서너번 정도 씻어주세요. 렌틸콩은 크기가 작아서 체에 받쳐 씻는 것이 편하답니다. 요것도 서너번 세척해주세요. 쌀 1컵과 렌틸콩 2큰술을 넣어줍니다. 1인분입니다. 물은 동량으로 1컵을 넣어줍니다. 요 상태에서 불릴 필요없이 바로 밥을 합니다. 불을 처음부터 약하게 하고 뚜껑을 닫아서 완성시키면 불 조절도 필요없구요. 밥물이 끓을 때쯤 뚜껑을 약간만 열어서 밥물이 넘치지 않게만 하면 됩니다. 뚝배기들이 뚜껑 없는 것들이 많은데, 이럴 때는 열에 강한 접시류를 얹어주어도 좋지요. 부드럽고 고소한 렌틸콩밥이 완성되었습니다.",노화방지,https://recipe1.ezmember.co.kr/cache/recipe/2015/06/21/509a02c58850251a516000585f7a938b1_m.jpg
656,젊게 오래 사는 비결 대추생강차,"감기 예방, 간 기능 보호에 성인병과 노화방지까지 손발이 찬 사람에게도 좋고 빈혈에도 좋은 대추를 차로 끓여 은은하게 즐겨보시는거 어때요?",[재료] 대추  40알 생강  50g 물  3리터 이상 [양념] 꿀  적당량,"일단 대추는 물에 깨끗하게 씻어서 건져주고, 생강은 껍질을 까서 편으로 썰어 준비합니다. 압력솥에 받아 놓은 물에 대추와 생강을 모두 넣고 뚜겅을 닫고 오랜 시간 추가 정신없이 흔들리고 나면 불의 세기를 약하게 줄여서 '칙칙' 약한 소리가 나도 계속해서 한 20-30분 정도. 끓여 줍니다. 다 끓여지고 나면 증기가 다 빠지고 나서 뚜껑을 열어줍니다. 다시 뚜껑을 연 채로 가스불을 켜서 5-10분정도 더 끓여주면 더욱 진하게 우러나요. 우려진 대추차는 따로 체에 밭쳐서 받아내고, 약간의 물을 더 넣고서 끓여 줍니다. 체에 밭쳐서 주걱으로 꾹꾹 국물을 눌러가면서 마지막 생긴 한방울까지 꾹 짜내요. 이렇게 만들어진 대추생강차는 병에 담아두고 그때그때 먹을 만큼씩만 데워서 꿀을 타서 드시면 되지요. 단것 넣지 않고 그냥 드셔도 좋고요.",노화방지,https://recipe1.ezmember.co.kr/cache/recipe/2015/10/29/8056f86418c1734c207c63c009b98121_m.jpg
657,전기밥솥으로 흑마늘 만들기,"고혈압, 당뇨, 노화, 신경통 등 각종 성인병의 개선 및 치유에 큰 도움이 되는 흑마늘을 직접 만들어보세요.",[재료] 마늘 ,마늘을 일일이 하나하나 떼어서 밥통에 담으세요. 이걸 언제 다 까나 싶어 그대로 했는데 말리는 과정에서 보니까 껍질을 까서 만든 녀석들이 더 잘 마르더라구요. 뚜껑을 닫고 보온으로 15일을 놔둡니다. 중간에 밥통 뚜껑을 여시면 절대로 안돼요! 마늘이 익어가는 동안 마늘 냄새가 아주 과하게 많이 납니다. 냄새가 싫으신 분들은 배란다 에다가 놓아 두시고 문을 꼬옥 닫아주고 신경을 완전히 끄세요. 날짜가 헷갈리지 않게 밥통 뚜껑 에다가 메모를 해두시거나 핸드폰으로 알람을 맞춰 주시면 좋겠죠? 15일 후의 모습입니다. 채반이라는 채반은 모두 동원 해서 널어줬습니다. 말리는 과정에서도 마늘 냄새가 솔솔 납니다. 중간 중간 빨리 마른 꾸득한 녀석을 골라 먹는 재미가 쏠쏠해요.,노화방지,https://recipe1.ezmember.co.kr/cache/recipe/2015/08/10/bf452df786a931a3f3f4e10e569392391_m.jpg
658,토마토달걀토스트,간단한 브런치메뉴로 좋은 토마토달걀토스트 소개합니다.,[재료] 식빵  2장 달걀  2개 청주  바질  토마토  10개 견과류  약간 [양념] 블루베리잼 ,"식빵은 그릴팬에 노릇하게 바삭하게 구워주세요. 달걀은 잘 풀어 청주,바질을 넣어 섞어주세요. 달군팬에 기름을 두르고 달걀을 넣어 스크램블을 만들어주세요. 방울토마토는 먹기좋게 썰어주시구요. 달걀스크램블을 옆쪽으로 치워놓고 방울토마토를 올리고 소금살짝 뿌려 구워주세요.",노화방지,https://recipe1.ezmember.co.kr/cache/recipe/2015/06/25/f8ca2a89f041c23906d9b7aa0cb57a5f1_m.jpg
659,콩자반!!! 딱딱하지 않고 물컹하지 않게 조리는 황금 레시피,"국민 밑반찬 콩자반~~ 일명 콩장~~콩자반의 생명은 뭐니뭐니해도 씹히는 딱딱함의 정도이죠
콩자반 너무 딱딱하면 정말 먹기 힘들어요
가뜩이나 턱 떡떡거리는 부정교합인 우리 아들은 
콩자반 먹다 병원 가야해요. 그렇다고 마냥 부드러우면 
정말 영~ 씹는 맛이 없어서 별루더라구요
이오만의 콩자반 딱 알맞게 익히는 황금비법을 자세히 알려드려요",[재료] 검은콩  4컵 [양념] 간장  2큰술 물엿  2국자 굵은 소금  1큰술 볶음깨  1큰술,깨끗히 씻어서 압력솥에 넣고푸욱 잠기도록 물을 부워주었어요압력솥 뚜껑을 닫고 압력을 걸어 추추추추~~추가 흔들리면 불을 일단 끄고추를 젖히지 않고 자연스럽게 김이 빠져나가도록 기다려요김이 다 빠져나가면 바로 뚜껑을 열고 익은 콩을 채에 바쳐서 물도 빼주고 식혀 주어요 다 식고 나면 코팅 냄비에 넣어 물 1큰술과 물엿을 넣어 주었어요 간장 넣고 소금 넣고 바글바글 조렸어요 볶음깨 뿌려주면 노화를 방지하고 다이어트와 성인병에도 좋은 콩자반 완성이요~~,노화방지,https://recipe1.ezmember.co.kr/cache/recipe/2015/10/03/db90c9f40991ded5ca7d5c61a3050ad01_m.jpg
660,고구마줄기볶음만들기,부드러운 식감이 좋은 초간단 고구마순볶음입니다~,[재료] 고구마줄기  400g 양파 ​  50g 홍고추  조금 [양념] 국간장  2숟갈 다진 마늘  1/2숟갈 멸치육수  3숟갈 (or 물) 들기름  약간 소금  약간,"고구마줄기는 껍질를 벗겨 잘 다듬어 준다. 다듬은 고구마순은 물에 소금을 조금 넣고 데친다. 손으로 눌러 보아 물러지면 건져 내어 찬물에 헹궈 물기를 꼭 짠 다음 먹기 좋은 크기로 자른다. 고구마순은 너무 짧게 썰지 말고 적당한 길이로 썰어야 먹음직스럽고 씹는 맛을 살릴 수 있답니다. 양파는 채 썬다. 홍고추는 송송 썬다. 고구마줄기를 벗길때 데쳐서 벗기면 더 잘 벗겨진답니다. 데친 고구마줄기에 국간장 2숟갈을 넣고~ 다진 마늘 1/2숟갈을 넣어 조물조물 무쳐 밑 양념을 한다. 팬에 기름을 두르고 무친 고구마순을 넣어 볶아준다. 1~2분 정도 볶다가 멸치육수(물) 3숟갈을 넣고 뚜껑을 덮어 중 약불에서 익힌다. 고구마순이 익었을 때 양파, 소금 2꼬집을 넣고 살짝 볶아 준다. 이때 간을 보아 소금으로 간을 맞춘다. 양파가 숨이 살짝 죽었을 때 홍고추, 깨, 들기름을 넣고 휘리릭 볶아주면 초간단 고구마순볶음 완성입니다.",노화방지,https://recipe1.ezmember.co.kr/cache/recipe/2015/08/20/e5fb369309621b17ed8cb00543b7d1bc1_m.jpg
661,조개쑥된장국,조개를 넣어서 시원한 맛이 나고 나른한 봄에 입맛 돋구는 쑥된장국입니다.,[재료] 쑥  멸치다시육수  다진마늘  조개  청양고추  홍고추  [양념] 된장  2수저 굵은소금(천일염) ,"물 5컵 (1000ml)에 멸치다시팩 넣고 끓여주세요. 육수가 노랗게 잘 우러났네요 다시팩은 건져주시고요. 전 냉동실에 있던 쑥을 사용했어요. 손질하고 데쳐서 냉동실에 넣어둔 거랍니다. 생쑥은 쓴 맛이 강한데요. 한번 데쳐서 바로 얼린거라 쓴 맛이 약해져서 좋아요. 얼린거지만 쑥향도 그대로라 좋아요. 물로 한번 깨끗히 씻어주었어요. 덩어리째 넣었답니다. 쑥은 끓는 물에서 금방 풀어진답니다. 이제 된장을 풀어주시면 됩니다. 된장은 2수저 정도만 했어요. 남은 된장도 털어주면 됩니다. 보통은 텁텁해지니 풀고 남은 된장 버리는데 쑥 된장국 끓일땐 다 넣어줘야 맛있더라고요. 다진 마늘도 한수저 넣어주세요. 전 얼려둔 마늘을 사용했어요. 쑥향이 강하니 안넣으신 분도 계시던데 전 넣어야 더 맛있더라고요. 마지막으로 조개를 넣어주면 국물맛이 깊어진답니다. 바지락,모시조개,백합 등 넣으시면 됩니다. 간이 부족하면 소금도 아주 살짝 넣어주세요. 전 굵은 천일염을 넣어주었어요. 이제 5분만 푹 끓여주세요. 향긋한 쑥 향이 집안 가득 퍼지네요. 마지막으로 잘게 썬 청량고추 5조각 정도 넣어주세요. 살짝 얼큰한 맛이 느껴져서 더 맛깔스럽답니다. 마무리는 홍고추로 포인트!!",노화방지,https://recipe1.ezmember.co.kr/cache/recipe/2015/05/19/8f0b879ae034dd1503abfd537a854c6f1_m.jpg
662,대구 맑은탕,"대구는 탕이나 전 등으로 만들어 먹을 수가 있는데요, 재료 본연의 맛을 느낄 수 있으며 국물 맛이 시원한 맑은탕을 끓여 보려고 준비했습니다. 시원하고 담백한 대구맑은탕 소개합니다.",[재료] 대구  1마리 무  배추  쑥갓  풋고추  2개 대파  1뿌리 마늘  4쪽 당근  약간 소금  [다시 국물 재료] 다시멸치  다시마  물 ,"대구는 등, 배 부분을 긁어내고 내장과 꼬리, 지느러미를 제거한 다음 아가미를 비롯해 흐르는 물에 깨끗하게 씻은 후 적당한 크기로 토막 내어줍니다 무는 흐르는 물에 씻은 후 나박 썰어주세요. 배추는 다듬어서 흐르는 물에 씻은 후 먹기 좋은 크기로 썰어주세요.대파와 마늘은 껍질을 벗겨 씻은 후 대파는 어슷 썰어주세요. 풋고추는 꼭지를 제거하고 흐르는 물에 씻은 후 어슷 썰고 쑥갓은 다듬어서 흐르는 물에 씻어서 물기를 빼주세요. 냄비에 물을 붓고 다시 멸치와 다시마를 넣고 다시 국물을 만들어주세요. 한소끔 끓으면 다시마는 먼저 건져냅니다. 다시 멸치를 건져내고 무와 배추를 넣고 끓여주세요. 손질한 대구를 넣고 끓여주세요. 풋고추와 대파, 다진 마늘을 넣고 끓인 후 소금으로 간을 맞춰주세요. 쑥갓을 넣고 한소끔 끓인 후 불에서 내려요.",노화방지,https://recipe1.ezmember.co.kr/cache/recipe/2015/05/23/893c83fb4dfb99d2b42e93b8cb6973241_m.jpg
663,토마토 마리네이드*토마토 바질 샐러드,"방울토마토는 먹기에도 편하지만 완숙 토마토에비해 영양가도 높다고 하네요.. 
출출할때 식사대용으로도 좋고.. 와인안주로도 좋답니다..",[재료] 방울토마토  건바질  다진양파  [드레싱 재료] 올리브오일  3큰술 식초  1큰술 (레몬즙으로 대체가능) 설탕  (또는꿀),토마토에 칼집을 내어주고.. 끓는물에 살짝 넣었다 건집니다.잠깐만 넣었다 건져도 껍질벗기기 느므 쉬워욤~ 요래 아기 엉덩이처럼 보송보송하게 껍질 벗겨 준비하시고.. 드라이바질이나 파슬리가루 준비하심 되는데.. 바질잎 따다가 생수에 담궈서 좀 싱싱하게 해두고.. 얼음물에 담구면 더 파릇파릇하다는데 걍 생수에만 담궈도 싱싱하더라구요~ 양파도 다져서 매운맛좀 빼주고.. 키친타올에 올려 물기를 꼼꼼히 빼주는 쎈쑤~ 드레싱재료는 올리브오일 3 식초1(레몬즙으로 대체가능) 설탕이나 꿀1 기본적으로 이렇게 넣음 되는데.. 과일짱은 냉장고에 파인애플 샐러드소스가있어서 설탕대신 파인애플소스를 넣어주었답니다.. 드레싱재료는 참고만하시고 냉장고속 이런저런 소스들 응용해서 넣음 되고요 샐러드볼에 토마토와 양파를 넣고.. 미리 만들어둔 샐러드소스를 넣어주어여~ 재료와 소스가 잘 어우러지도록 버무려주고.. 생바질잎은 연약하니까..ㅋ 마지막에 넣어 주어여~ 재료와 잘 섞이도록 살살 버무려주면 토마토마리네이드.. 일명 토마토바질샐러드 완성..!!,노화방지,https://recipe1.ezmember.co.kr/cache/recipe/2015/03/26/a0a1c0f8981ee1180be6989190ba311b1_m.jpg
664,멍게비빔밥,,,,노화방지,https://recipe1.ezmember.co.kr/cache/recipe/2015/06/05/8b4b74a9bb9037721ddf492bf3bc2442_m.jpg
665,여주볶음 만드는 법,영양 만점~ 아삭아삭 여주볶음입니다.,[재료] 여주  1개 (150g) 양파  30g 게맛살  2개 계란  2개 마늘  3쪽 카놀라유  약간 [양념] 참기름  약간 소금  약간 깨  ​,여주는 반으로 자르고 수저로 속을 긁어 낸다. 채 썬 다음 간간한 소금물에 담가 냉장고에 1시간 정도 두어 쓴맛을 뺀다. 생여주 쓴맛 빼주는 방법은 살짝 데친다. 찬물에 담근다. 소금물에 담그는 방법이 있답니다. 마늘은 편 썬다. 양파는 채 썬다. 계란은 소금 한 꼬집을 넣고 풀어 놓는다. 게맛살은 4㎝ 길이로 먹기 좋게 등분하여 자른다. 팬에 기름을 두르고 슬라이스 한 마늘을 넣어 살짝 볶아 준다. 마늘향을 낸 후 여주와 양파를 넣고 볶아 준다. 이때 간을 보아 소금으로 간을 맞춘다. 양파가 맑갛게 익어갈 때 게맛살을 넣고 살짝 볶아 준다. 재료를 한쪽으로 밀어 놓고 풀어 놓은 계란을 부어 스크램블을 만든다. 밀어 놓은 재료와 계란 스크램블이 골고루 섞어 지도록 살짝 볶는다. 마지막에 참기름과 깨 송송 뿌려 주면 여주볶음 만드는법 완성입니다.,노화방지,https://recipe1.ezmember.co.kr/cache/recipe/2015/08/12/785568cb0a53d4df0fc82d46757705651_m.jpg
666,제철 가지로 만든 가지피자,가지의 물컹한 식감때문에 건강에 좋은 가지를 아이들이 많이 안좋아하더라구요. 노화와 암을 예방하는 안토시아닌 성분이 풍부한 가지로 아이들도 좋아할 만한 가지피자 만들어볼게요.,[재료] 가지  소고기  양파  두부  [양념] 다진마늘  들기름  소금  후추  토마토소스  피자치즈 ,"들기름 두른 팬에 다진 마늘과 곱게 썬 양파를 볶다가 다진 소고기, 소금, 후추넣어 볶아 주어요. 소고기가 80%익었다 싶을 때 토마토소스를 넣어 센불에서 물기없이 볶아주세요. 물기 꾹 짠 두부를 칼등으로 으깨 소스에 넣어 다시 한 번 볶아줘요. 세척한 가지는 길이로 반 갈라 속의 씨를 깊이 1cm정도만 파 주어요. 파낸 부분에 소금 살짝 뿌려 잠시 후 키친타월로 수분 닦아내고 들기름 살짝 발라준뒤 파낸 속만큼 만들어 놓은 피자소스를 채워 주세요. 피자치즈 뿌려 180도 15분 설정한 오븐에 넣어 구워주면 완성입니다.오븐",노화방지,https://recipe1.ezmember.co.kr/cache/recipe/2015/05/15/e475169a922d280c635155f699e9deb21.jpg
667,단호박스무디 만들기,섬유질이 풍부한 단호박으로 만드는 달콤하고 부드러운 단호박스무디!,[재료] 단호박  1개 우유  꿀 ,"단호박은 씨와 꼭지를 제거하고 4등분으로 썰어 줍니다. 단호박은 김이 오른 찜통에 올려서 쪄 줍니다. 쪄 낸 단호박은 속을 파서 우유, 꿀과 함께 믹서에 갈아줍니다. 우유와 꿀은 취향에 맞게 넣으시면 됩니다. 단호박스무디를 컵에 따라내면 완성!",노화방지,https://recipe1.ezmember.co.kr/cache/recipe/2015/04/15/08903b4f80ed07d769b4af3ec2d0e6021_m.jpg
668,밥반찬으로 좋은 명태알 조림,명태알은 비타민E 인 토코페롤이 많아 생식기능의 정상화와노화를 방지합니다.,[재료] 명태알  300g 조림양념장(맛간장)  1/2컵 물  1컵 미림  2T 올리고당  1T 마늘  2쪽 생강가루 톡톡  5번 청고추  1개 홍고추  1개,명태알을 꺠깨끗하게 씻어줍니다 끓는물에 소금을조금넣고 익혀줍니다 양념장을만들어둡니다 맛간장을이용해서 조리면 간편한데요 다음에 맛간장만드는법 올릴께요 맛간장하나잇음모든조림이 가능하죠 ^^ 데친명태알을넣고 양념장을 부어줍니다 센불이아닌불에서 조려주세요 자작하니 조림장이 조금남았을때 청홍고추를 썰어서 넣어주세요,노화방지,https://recipe1.ezmember.co.kr/cache/recipe/2015/04/22/76043d7451ac97fe539cb9b2779dbb2c1_m.jpg
669,생강 무 꿀 대추차와 대추계피 꿀 버무리~ 감기 예방과 치료!!,"감기에 걸린 큰딸을 위해 
면역력을 높이고 체온을 올리는 생강. 무 넣고 대추도 넣고 체력저하와 피곤할 때 좋은 꿀도 넣어서 감기야 떨어져라~~ 뾰로롱 얍~~",[재료] 생강  2톨 대추  1줌 무우  1컵 [양념] 꿀  4큰술 계피가루  2작은술,"생강과 대추는 늘 냉동실에 얼려두는 이오~~ 생강을 꺼내서 깨끗하게 씻었어요 얼린 생강은 씻으면서 표면이 녹기시작해서 조금만 수고하면 껍질이 후루룩 벗겨져요 얇팍하게 썰어두고 무도 준비했어요 무도 얇팍하게 썰고 물에 생강 투하~ 무도 투하~ 꿀도 넉넉히 넣고 끓이다가 깨끗히 씻은 대추 넣고 바글바글 끓으면 대추 건져냈어요 요렇게 꿀, 계피가루 준비해서~~ 대추에 꿀 뿌리고 따뜻한 성질 갑인 계피~~감가 예방과 치료에 탁월한 계피~ 계피가루 넣어 생강. 무. 꿀차와 대추.계피.꿀 버무리로 짜쟌~~~ 간식 겸 약으로",노화방지,https://recipe1.ezmember.co.kr/cache/recipe/2015/10/30/960975c945e0fb2405a3f9f944da88ef1_m.jpg
